<?xml version="1.0" encoding="UTF-8"?>
<xs:schema xmlns:xs="http://www.w3.org/2001/XMLSchema" elementFormDefault="qualified">
<xs:element name="personas">
    <xs:complexType>
        <xs:sequence>
        <xs:element name="persona" maxOccurs="unbounded">
            <xs:complexType>
                <xs:all>
                <xs:element name="nombre" type="xs:string"/>
                <xs:element name="apellido" type="xs:string"/>
                </xs:all>
            </xs:complexType>
        </xs:element>
        <xs:element name="trabajadores" maxOccurs="unbounded">
            <xs:complexType>
                <xs:choice>
                    <xs:element name="miembros" type="xs:string"/>
                    <xs:element name="empleado" type="xs:string"/>
                </xs:choice>
            </xs:complexType>
        </xs:element>
        </xs:sequence>
    </xs:complexType>
</xs:element>
</xs:schema>